[
  {
    "id": "acid_splash",
    "name_zh": "酸液飞溅",
    "name_en": "Acid Splash",
    "level": 0,
    "school": "conjuration",
    "school_zh": "咒法",
    "ritual": false,
    "source_page": 211,
    "classes": [
      "sorcerer",
      "wizard"
    ],
    "types": [
      "damage"
    ],
    "cooldown_rounds": 0,
    "concentration": false,
    "duration": "立即",
    "damage_calculation": {
      "base": [
        "1d6"
      ],
      "method": "dexterity_save",
      "on_save": "none",
      "scaling": "你到达 5 级时， 该法术的伤害增加1d6（变为 2d6）。 11 级 时再加 1d6（变为 3d6），17 级时再加 1d6（变为 4d6）。",
      "details": "在施法距离内指定一个你能看见的生 物，或者在施法距离内指定你能看见的两个相距不超过 5 尺的 生物。 每个目标必须进行一次敏捷豁免，豁免失败则受到 1d6 点强酸伤害。"
    },
    "healing_calculation": null
  },
  {
    "id": "aid",
    "name_zh": "援助术",
    "name_en": "Aid",
    "level": 2,
    "school": "abjuration",
    "school_zh": "防护",
    "ritual": false,
    "source_page": 211,
    "classes": [
      "cleric",
      "paladin"
    ],
    "types": [
      "healing"
    ],
    "cooldown_rounds": 2,
    "concentration": false,
    "duration": "8 小时",
    "damage_calculation": null,
    "healing_calculation": {
      "base": [
        "special"
      ],
      "scaling": "升环施法效应。 使用 3 环或更高法术位施展该法术时，你 使用的法术位每比 2 环高一环，每个目标的生命值上限和当前 生命值就额外提高 5 点。",
      "details": "每个目标的生命值上限和当前生命值在法术持续 时间内提高 5 点。"
    }
  },
  {
    "id": "alarm",
    "name_zh": "警报术",
    "name_en": "Alarm",
    "level": 1,
    "school": "abjuration",
    "school_zh": "防护",
    "ritual": true,
    "source_page": 211,
    "classes": [
      "ranger",
      "wizard"
    ],
    "types": [
      "exploration"
    ],
    "cooldown_rounds": 1,
    "concentration": false,
    "duration": "8 小时",
    "damage_calculation": null,
    "healing_calculation": null
  },
  {
    "id": "alter_self",
    "name_zh": "变身术",
    "name_en": "Alter Self",
    "level": 2,
    "school": "transmutation",
    "school_zh": "变化",
    "ritual": false,
    "source_page": 211,
    "classes": [
      "sorcerer",
      "wizard"
    ],
    "types": [
      "damage",
      "mobility"
    ],
    "cooldown_rounds": 2,
    "concentration": true,
    "duration": "专注，至多 1 小时",
    "damage_calculation": {
      "base": [
        "1d6"
      ],
      "method": "special",
      "on_save": null,
      "scaling": null,
      "details": "你长出尖牙锐爪、棘刺长角， 或是其他类型的一种自选的天生武器。 所选的天生武器可以使 你的徒手打击造成 1d6 的钝击、挥砍或穿刺伤害，且你视为具 有徒手打击的熟练项。"
    },
    "healing_calculation": null
  },
  {
    "id": "animal_friendship",
    "name_zh": "化兽为友",
    "name_en": "Animal Friendship",
    "level": 1,
    "school": "enchantment",
    "school_zh": "附魔",
    "ritual": false,
    "source_page": 212,
    "classes": [
      "bard",
      "druid",
      "ranger"
    ],
    "types": [
      "control"
    ],
    "cooldown_rounds": 1,
    "concentration": false,
    "duration": "24 小时",
    "damage_calculation": null,
    "healing_calculation": null
  },
  {
    "id": "animal_messenger",
    "name_zh": "动物信使",
    "name_en": "Animal Messenger",
    "level": 2,
    "school": "enchantment",
    "school_zh": "附魔",
    "ritual": true,
    "source_page": 212,
    "classes": [
      "bard",
      "druid",
      "ranger"
    ],
    "types": [
      "exploration"
    ],
    "cooldown_rounds": 2,
    "concentration": false,
    "duration": "24 小时",
    "damage_calculation": null,
    "healing_calculation": null
  },
  {
    "id": "animal_shapes",
    "name_zh": "动物形态",
    "name_en": "Animal Shapes",
    "level": 8,
    "school": "transmutation",
    "school_zh": "变化",
    "ritual": false,
    "source_page": 212,
    "classes": [
      "druid"
    ],
    "types": [
      "control"
    ],
    "cooldown_rounds": 8,
    "concentration": true,
    "duration": "专注，至多 24 小时",
    "damage_calculation": null,
    "healing_calculation": null
  },
  {
    "id": "animate_dead",
    "name_zh": "操纵死尸",
    "name_en": "Animate Dead",
    "level": 3,
    "school": "necromancy",
    "school_zh": "死灵",
    "ritual": false,
    "source_page": 212,
    "classes": [
      "cleric",
      "wizard"
    ],
    "types": [
      "summoning"
    ],
    "cooldown_rounds": 3,
    "concentration": false,
    "duration": "立即",
    "damage_calculation": null,
    "healing_calculation": null
  },
  {
    "id": "animate_objects",
    "name_zh": "活化物件",
    "name_en": "Animate Objects",
    "level": 5,
    "school": "transmutation",
    "school_zh": "变化",
    "ritual": false,
    "source_page": 213,
    "classes": [
      "bard",
      "sorcerer",
      "wizard"
    ],
    "types": [
      "damage",
      "control",
      "defense",
      "mobility",
      "summoning"
    ],
    "cooldown_rounds": 5,
    "concentration": true,
    "duration": "专注，至多 1 分钟",
    "damage_calculation": {
      "base": [
        "1d4+4",
        "1d8+2",
        "2d6+1",
        "2d10+2",
        "2d12+4"
      ],
      "method": "special",
      "on_save": null,
      "scaling": "升环施法效应。 使用 6 环或更高法术位施展该法术时，你 使用的法术位每比 5 环高一环，就多唤起两个物件。",
      "details": "一旦被下达 命令，该生物会持续执行命令直到任务完成。 活化物件属性资料 Animated Object Statistics 体型 HP AC 攻击 力量 敏捷 微型 20 18 命中+8，伤害 1d4+4 4 18 小型 25 16 命中+6，伤害 1d8+2 6 14 中型 40 13 命中+5，伤害 2d6+1 10 12 大型 50 10 命中+6，伤害 2d10+2 14 10 巨型 80 10 命中+8，伤害 2d12+4 18 6 被活化物件的 AC、HP、 攻击， 以及力量和敏捷值由其体型 决定。"
    },
    "healing_calculation": null
  },
  {
    "id": "antilife_shell",
    "name_zh": "防活物护罩",
    "name_en": "Antilife Shell",
    "level": 5,
    "school": "abjuration",
    "school_zh": "防护",
    "ritual": false,
    "source_page": 213,
    "classes": [
      "druid"
    ],
    "types": [
      "defense",
      "mobility"
    ],
    "cooldown_rounds": 5,
    "concentration": true,
    "duration": "专注，至多 1 小时",
    "damage_calculation": null,
    "healing_calculation": null
  },
  {
    "id": "antimagic_field",
    "name_zh": "反魔法力场",
    "name_en": "Antimagic Field",
    "level": 8,
    "school": "abjuration",
    "school_zh": "防护",
    "ritual": false,
    "source_page": 213,
    "classes": [
      "cleric",
      "wizard"
    ],
    "types": [
      "control",
      "defense",
      "mobility"
    ],
    "cooldown_rounds": 8,
    "concentration": true,
    "duration": "专注，至多 1 小时",
    "damage_calculation": null,
    "healing_calculation": null
  },
  {
    "id": "antipathy_sympathy",
    "name_zh": "嫌恶／关怀术",
    "name_en": "Antipathy/Sympathy",
    "level": 8,
    "school": "enchantment",
    "school_zh": "附魔",
    "ritual": false,
    "source_page": 214,
    "classes": [
      "druid",
      "wizard"
    ],
    "types": [
      "control",
      "defense"
    ],
    "cooldown_rounds": 8,
    "concentration": false,
    "duration": "10 天",
    "damage_calculation": null,
    "healing_calculation": null
  },
  {
    "id": "arcane_eye",
    "name_zh": "秘法眼",
    "name_en": "Arcane Eye",
    "level": 4,
    "school": "divination",
    "school_zh": "预言",
    "ritual": false,
    "source_page": 214,
    "classes": [
      "wizard"
    ],
    "types": [
      "mobility"
    ],
    "cooldown_rounds": 4,
    "concentration": true,
    "duration": "专注，至多 1 小时",
    "damage_calculation": null,
    "healing_calculation": null
  },
  {
    "id": "arcane_gate",
    "name_zh": "秘法门",
    "name_en": "Arcane Gate",
    "level": 6,
    "school": "conjuration",
    "school_zh": "咒法",
    "ritual": false,
    "source_page": 214,
    "classes": [
      "sorcerer",
      "warlock",
      "wizard"
    ],
    "types": [
      "mobility"
    ],
    "cooldown_rounds": 6,
    "concentration": true,
    "duration": "专注，至多 10 分钟",
    "damage_calculation": null,
    "healing_calculation": null
  },
  {
    "id": "arcane_lock",
    "name_zh": "秘法锁",
    "name_en": "Arcane Lock",
    "level": 2,
    "school": "abjuration",
    "school_zh": "防护",
    "ritual": false,
    "source_page": 215,
    "classes": [
      "wizard"
    ],
    "types": [
      "exploration"
    ],
    "cooldown_rounds": 2,
    "concentration": false,
    "duration": "直到被解除",
    "damage_calculation": null,
    "healing_calculation": null
  },
  {
    "id": "armor_of_agathys",
    "name_zh": "艾嘉西斯之铠",
    "name_en": "Armor of Agathys",
    "level": 1,
    "school": "abjuration",
    "school_zh": "防护",
    "ritual": false,
    "source_page": 215,
    "classes": [
      "warlock"
    ],
    "types": [
      "defense"
    ],
    "cooldown_rounds": 1,
    "concentration": false,
    "duration": "１小时",
    "damage_calculation": null,
    "healing_calculation": null
  },
  {
    "id": "arms_of_hadar",
    "name_zh": "哈达之臂",
    "name_en": "Arms of Hadar",
    "level": 1,
    "school": "conjuration",
    "school_zh": "咒法",
    "ritual": false,
    "source_page": 215,
    "classes": [
      "warlock"
    ],
    "types": [
      "damage"
    ],
    "cooldown_rounds": 1,
    "concentration": false,
    "duration": "立即",
    "damage_calculation": {
      "base": [
        "2d6"
      ],
      "method": "strength_save",
      "on_save": "half",
      "scaling": "升环施法效应。 使用２环或更高法术位施展该法术时，你 使用的法术位每比１环高一环，法术的伤害就增加 1d6。",
      "details": "黑暗能量构成的触须从你身上蔓延而出并痛击 10 尺内的所有 生物。 范围内的所有生物都必须进行一次力量豁免，豁免失败 者将受到 2d6 点黯蚀伤害，并其下一回合前都无法执行反应。"
    },
    "healing_calculation": null
  },
  {
    "id": "astral_projection",
    "name_zh": "星界投影",
    "name_en": "Astral Projection",
    "level": 9,
    "school": "necromancy",
    "school_zh": "死灵",
    "ritual": false,
    "source_page": 215,
    "classes": [
      "cleric",
      "warlock",
      "wizard"
    ],
    "types": [
      "control",
      "mobility"
    ],
    "cooldown_rounds": 9,
    "concentration": false,
    "duration": "特殊",
    "damage_calculation": null,
    "healing_calculation": null
  },
  {
    "id": "augury",
    "name_zh": "卜筮术",
    "name_en": "Augury",
    "level": 2,
    "school": "divination",
    "school_zh": "预言",
    "ritual": true,
    "source_page": 215,
    "classes": [
      "cleric"
    ],
    "types": [
      "exploration"
    ],
    "cooldown_rounds": 2,
    "concentration": false,
    "duration": "立即",
    "damage_calculation": null,